url_path,tag,cover_image,location,property_name,developer_logo,title,description,m2,payment_plan,price,Beds,Baths
https://www.nawy.com/compound/364-vinci-street/property/7346-vinci-street-f-b-first-floor,,https://prod-images.cooingestate.com/processed/inventory/brochure_images/Misr%20Italia%20Properties/vincistreet/F_B.jpg/high.webp,New Capital City,"Retail, Vinci Street",https://prod-images.cooingestate.com/processed/developer/logo_image/55/medium.webp,Retail for sale in Vinci Street - with in New Capital City by Misr Italia Properties.,Retail for sale in Vinci Street - with in New Capital City by Misr Italia Properties.,70,"273,594 EGP quarterly / 8 Years","10,300,000 EGP",,
https://www.nawy.com/compound/1026-el-fustat/property/111128-Retail-for-sale-in-El%20Fustat-with-10-bedrooms-in-Old%20Cairo-by-Saudi%20Egyptian%20Developers%20(SED),,https://prod-images.cooingestate.com/processed/inventory/brochure_images/Saudi%20Egyptian%20Developer/elfustat/Screenshot%202026-02-18%20175346/high.webp,Old Cairo,"Retail, El Fustat",https://prod-images.cooingestate.com/processed/developer/logo_image/87/medium.webp,Retail for sale in El Fustat - with 5 bedrooms in Old Cairo by Saudi Egyptian Developers (SED).,Retail for sale in El Fustat - with 5 bedrooms in Old Cairo by Saudi Egyptian Developers (SED).,302,"1,491,011 EGP quarterly / 7 Years","46,387,000 EGP",5,6
https://www.nawy.com/compound/1725-villa-mall-new-capital/property/100381-Retail-for-sale-in-Villa%20Mall%20New%20Capital-with-10-bedrooms-in-New%20Capital%20City-by-Better%20Home,,https://prod-images.cooingestate.com/processed/inventory/brochure_images/Better%20Home/villamallnewcapital/Screenshot%202025-11-04%20191500/high.webp,New Capital City,"Retail, Villa Mall New Capital",https://prod-images.cooingestate.com/processed/developer/logo_image/122/medium.webp,Retail for sale in Villa Mall New Capital - with in New Capital City by Better Home.,Retail for sale in Villa Mall New Capital - with in New Capital City by Better Home.,120,"586,943 EGP quarterly / 8 Years","20,869,078 EGP",,
https://www.nawy.com/compound/501-pyramids-mall/property/115406-retail-for-sale-in-pyramids-mall-in-new-capital-city-by-pyramids-developments,Resale,https://prod-images.cooingestate.com/processed/inventory/unlockedProperties/115406/daf18d6c-a7e7-4a27-bec8-6c37423b2995/high.webp,New Capital City,"Retail, Pyramids Mall",https://prod-images.cooingestate.com/processed/developer/logo_image/113/medium.webp,Retail for sale in Pyramids Mall - with in New Capital City by Pyramids Developments.,Retail for sale in Pyramids Mall - with in New Capital City by Pyramids Developments.,28,"342,720 EGP quarterly / 2.5 Years","12,225,380 EGP",,
https://www.nawy.com/compound/377-the-hub--waterway-new-cairo/property/63321-retail-for-sale-in-the-hub-waterway-new-cairo-with-1-bedrooms-in-new-cairo-by-the-waterway-developments,Resale,https://prod-images.cooingestate.com/processed/inventory/unlockedProperties/63321/43170494-882a-4aac-a765-1ead156b0303/high.webp,New Cairo,"Retail, The HUB  Waterway New Cairo",https://prod-images.cooingestate.com/processed/developer/logo_image/64/medium.webp,Retail for sale in The HUB  Waterway New Cairo - with 1 bedroom in New Cairo by The Waterway Developments.,Retail for sale in The HUB  Waterway New Cairo - with 1 bedroom in New Cairo by The Waterway Developments.,64,,"22,400,000 EGP",1,1
https://www.nawy.com/compound/1343-apex-business-complex/property/104509-retail-for-sale-in-apex-business-complex,Resale,https://prod-images.cooingestate.com/processed/property_image/image/571279/high.webp,New Capital City,"Retail, Apex Business Complex",https://prod-images.cooingestate.com/processed/developer/logo_image/306/medium.webp,Retail for sale in Apex Business Complex - with in New Capital City by LUD -Lozan Urban Development.,Retail for sale in Apex Business Complex - with in New Capital City by LUD -Lozan Urban Development.,29,"52,690 EGP monthly / 9 Years","8,603,297 EGP",,
https://www.nawy.com/compound/2007-Plus%20Plus/property/117514-Retail-for-sale-in-Plus%20Plus-with-10-bedrooms-in-New%20Cairo-by-Horizon%20Egypt%20Development,,https://prod-images.cooingestate.com/processed/inventory/brochure_images/Horizon%20Egypt%20Development/plusplus/Screenshot%202026-03-03%20170624/high.webp,New Cairo,"Retail, Plus Plus",https://prod-images.cooingestate.com/processed/developer/logo_image/325/medium.webp,Retail for sale in Plus Plus - with in New Cairo by Horizon Egypt Development.,Retail for sale in Plus Plus - with in New Cairo by Horizon Egypt Development.,122,"1,153,929 EGP quarterly / 7 Years","35,900,000 EGP",,
https://www.nawy.com/compound/1366-cliff/property/87051-retail-for-sale-in-cliff-in-new-cairo-by-the-ark-development,,https://prod-images.cooingestate.com/processed/property_image/image/437510/high.webp,New Cairo,"Retail, Cliff",https://prod-images.cooingestate.com/processed/developer/logo_image/219/medium.webp,Retail for sale in Cliff  - with in New Cairo by The Ark Development.,Retail for sale in Cliff  - with in New Cairo by The Ark Development.,158,"2,941,500 EGP quarterly / 5 Years","63,600,000 EGP",,
https://www.nawy.com/compound/826-wingate-north-90st./property/74165-retail-for-sale-in-wingate-north-90st,Resale,https://prod-images.cooingestate.com/processed/property_image/image/371645/high.webp,New Cairo,"Retail, Wingate North 90St.",https://prod-images.cooingestate.com/processed/developer/logo_image/251/medium.webp,Retail for sale in Wingate North 90St. - with in New Cairo by Wealth Development.,Retail for sale in Wingate North 90St. - with in New Cairo by Wealth Development.,155,"589,000 EGP monthly / 5 Years","52,397,487 EGP",,
https://www.nawy.com/compound/792-the-8/property/110983-retail-for-sale-in-the-8,Resale,https://prod-images.cooingestate.com/processed/property_image/image/630597/high.webp,Northern Expansion,"Retail, The 8",https://prod-images.cooingestate.com/processed/developer/logo_image/241/medium.webp,Retail for sale in The 8 - with in Northern Expansion by El Gabry Developments.,Retail for sale in The 8 - with in Northern Expansion by El Gabry Developments.,51,"18,280 EGP monthly / 4 Years","6,025,000 EGP",,
https://www.nawy.com/compound/1044-the-lark-mall/property/42524-retail-ground-for-sale-in-the-lark-mall-in-new-cairo-by-tamayoz-developments,,https://prod-images.cooingestate.com/processed/property_image/image/209269/high.webp,South Investors,"Retail, The Lark Mall",https://prod-images.cooingestate.com/processed/developer/logo_image/338/medium.webp,Retail for sale in The Lark Mall - with in South Investors by Tamayoz Developments.,Retail for sale in The Lark Mall - with in South Investors by Tamayoz Developments.,50,,"17,115,000 EGP",,
https://www.nawy.com/compound/928-it-business-hub/property/86622-retail-for-sale-in-it-business-hub,Resale,https://prod-images.cooingestate.com/processed/property_image/image/653558/high.webp,New Cairo,"Retail, It Business Hub",https://prod-images.cooingestate.com/processed/developer/logo_image/144/medium.webp,Retail for sale in It Business Hub - with in New Cairo by Upwyde Developments.,Retail for sale in It Business Hub - with in New Cairo by Upwyde Developments.,130,"581,950 EGP monthly / 4 Years","40,846,559 EGP",,
https://www.nawy.com/compound/1933-Rafts%20Business%20District/property/116503-retail-for-sale-in-rafts-business-district-by-the-ark-development,,https://prod-images.cooingestate.com/processed/inventory/brochure_images/The%20Ark%20Development/raftsbusinessdistrict/Capture%20-%20Copy/high.webp,6th of October City,"Retail, Rafts Business District",https://prod-images.cooingestate.com/processed/developer/logo_image/219/medium.webp,Retail for sale in Rafts Business District - with in 6th of October City by The Ark Development.,Retail for sale in Rafts Business District - with in 6th of October City by The Ark Development.,42,"382,200 EGP quarterly / 7.5 Years","12,740,000 EGP",,
https://www.nawy.com/compound/844-atom/property/116738-retail-for-sale-in-atom-in-new-cairo-by-make-place-developments,Resale,https://prod-images.cooingestate.com/processed/inventory/unlockedProperties/116738/b410fc40-5f16-42bd-90ab-0f4f39533ae4/high.webp,New Cairo,"Retail, Atom",https://prod-images.cooingestate.com/processed/developer/logo_image/257/medium.webp,Retail for sale in Atom - with in New Cairo by Make Place Developments.,Retail for sale in Atom - with in New Cairo by Make Place Developments.,86,"544,167 EGP quarterly / 3 Years","27,530,000 EGP",,
https://www.nawy.com/compound/1926-mall-t-square/property/113149-Retail-for-sale-in-Mall%20T%20Square-with-10-bedrooms-in-El%20Sheikh%20Zayed-by-Torec%20Developments,,https://prod-images.cooingestate.com/processed/inventory/brochure_images//malltsquare/Screenshot%202026-01-22%20124456/high.webp,El Sheikh Zayed,"Retail, Mall T Square",https://prod-images.cooingestate.com/processed/developer/logo_image/513/medium.webp,Retail for sale in Mall T Square - with in El Sheikh Zayed by Torec Developments.,Retail for sale in Mall T Square - with in El Sheikh Zayed by Torec Developments.,27,"284,238 EGP quarterly / 4 Years","6,063,748 EGP",,
https://www.nawy.com/compound/339-lakeyard--hacienda-bay/property/111492-retail-for-sale-in-lakeyard-hacienda-bay,Resale,https://prod-images.cooingestate.com/processed/property_image/image/636386/high.webp,Sidi Abdel Rahman,"Retail, Lakeyard  Hacienda Bay",https://prod-images.cooingestate.com/processed/developer/logo_image/16/medium.webp,Retail for sale in Lakeyard  Hacienda Bay - with in Sidi Abdel Rahman by Palm Hills Developments.,Retail for sale in Lakeyard  Hacienda Bay - with in Sidi Abdel Rahman by Palm Hills Developments.,167,,"41,000,000 EGP",,
https://www.nawy.com/compound/1270-radix-agile/property/72963-retail-for-sale-in-radix-agile-in-new-capital-city-by-radix-development,,https://prod-images.cooingestate.com/processed/property_image/image/366969/high.webp,New Capital City,"Retail, Radix Agile",https://prod-images.cooingestate.com/processed/developer/logo_image/293/medium.webp,Retail for sale in Radix Agile - with in New Capital City by Radix Development.,Retail for sale in Radix Agile - with in New Capital City by Radix Development.,35,"427,500 EGP quarterly / 7 Years","13,300,000 EGP",,
https://www.nawy.com/compound/1034-dejoya-plaza-residence/property/41229-en,,https://prod-images.cooingestate.com/processed/property_image/image/191267/high.webp,New Zayed,"Retail, Dejoya Plaza Residence",https://prod-images.cooingestate.com/processed/developer/logo_image/138/medium.webp,Retail for sale in Dejoya Plaza Residence - with in New Zayed by Taj Misr Developments.,Retail for sale in Dejoya Plaza Residence - with in New Zayed by Taj Misr Developments.,332,"1,788,318 EGP quarterly / 15 Years","112,946,400 EGP",,
https://www.nawy.com/compound/1518-maliv-street/property/81639-Retail-for-sale-in-Maliv%20Street-with-10-bedrooms-in-6th%20settlement-by-Kulture%20Developments,,https://prod-images.cooingestate.com/processed/inventory/brochure_images/Kulture%20Developments/malivstreet/Maliv%20st%202/high.webp,6th settlement,"Retail, Maliv Street",https://prod-images.cooingestate.com/processed/developer/logo_image/427/medium.webp,Retail for sale in Maliv Street - with in 6th settlement by Kulture Developments.,Retail for sale in Maliv Street - with in 6th settlement by Kulture Developments.,193,"1,239,522 EGP quarterly / 6 Years","31,314,250 EGP",,
https://www.nawy.com/compound/794-de-joya-1-strip-mall/property/40138-retail-for-sale-in-de-joya-1-strip-mall-in-new-capital-city-by-taj-misr-developments,,https://prod-images.cooingestate.com/processed/property_image/image/182122/high.webp,New Capital City,"Retail, De joya 1 strip mall",https://prod-images.cooingestate.com/processed/developer/logo_image/138/medium.webp,Retail for sale in De joya 1 strip mall - with in New Capital City by Taj Misr Developments.,Retail for sale in De joya 1 strip mall - with in New Capital City by Taj Misr Developments.,50,"212,625 EGP quarterly / 10 Years","9,450,000 EGP",,
https://www.nawy.com/compound/514-ezdan/property/93084-retail-for-sale-in-ezdan-in-new-capital-city-by-taj-misr-developments,,https://prod-images.cooingestate.com/processed/property_image/image/471461/high.webp,New Capital City,"Retail, Ezdan",https://prod-images.cooingestate.com/processed/developer/logo_image/138/medium.webp,Retail for sale in Ezdan - with in New Capital City by Taj Misr Developments.,Retail for sale in Ezdan - with in New Capital City by Taj Misr Developments.,29,"263,854 EGP quarterly / 6 Years","7,450,000 EGP",,
https://www.nawy.com/compound/545-granvia-mall-serrano/property/6306-serrano-new-plan-granvia-ground-floor,,https://www.nawy.com/assets/images/common/broken.webp,New Capital City,"Retail, Granvia Mall Serrano",https://prod-images.cooingestate.com/processed/developer/logo_image/136/medium.webp,Retail for sale in Granvia Mall Serrano - with in New Capital City by New Plan.,Retail for sale in Granvia Mall Serrano - with in New Capital City by New Plan.,33,"252,450 EGP quarterly / 5 Years","5,610,000 EGP",,
https://www.nawy.com/compound/439-citadel-commercial-complex/property/84839-Retail-for-sale-in-Citadel%20Commercial%20Complex-with-10-bedrooms-in-New%20Capital%20City-by-Sorouh%20Developments,,https://prod-images.cooingestate.com/processed/inventory/brochure_images/Sorouh%20Developments/citadelcommercialcomplex/1%202/high.webp,New Capital City,"Retail, Citadel Commercial Complex",https://prod-images.cooingestate.com/processed/developer/logo_image/120/medium.webp,Retail for sale in Citadel Commercial Complex - with in New Capital City by Sorouh Developments.,Retail for sale in Citadel Commercial Complex - with in New Capital City by Sorouh Developments.,92,"788,063 EGP quarterly / 6 Years","21,015,000 EGP",,
https://www.nawy.com/compound/795-de-joya-2-strip-mall/property/45496-retail-for-sale-in-de-joya-2-strip-mall-in-new-capital-city-by-taj-misr-developments,,https://www.nawy.com/assets/images/common/broken.webp,New Capital City,"Retail, De joya 2 strip mall",https://prod-images.cooingestate.com/processed/developer/logo_image/138/medium.webp,Retail for sale in De joya 2 strip mall - with in New Capital City by Taj Misr Developments.,Retail for sale in De joya 2 strip mall - with in New Capital City by Taj Misr Developments.,58,"240,278 EGP quarterly / 10 Years","10,679,000 EGP",,
https://www.nawy.com/compound/748-taj-tower/property/40034-en,,https://prod-images.cooingestate.com/processed/property_image/image/180940/high.webp,New Capital City,"Retail, Taj Tower",https://prod-images.cooingestate.com/processed/developer/logo_image/138/medium.webp,Retail for sale in Taj Tower - with in New Capital City by Taj Misr Developments.,Retail for sale in Taj Tower - with in New Capital City by Taj Misr Developments.,35,"289,406 EGP quarterly / 10 Years","12,862,500 EGP",,
https://www.nawy.com/compound/1840-dejoya-4-strip-mall/property/101666-retail-for-sale-in-dejoya-4-strip-mall-in-new-capital-city-by-taj-misr-developments,,https://prod-images.cooingestate.com/processed/property_image/image/551383/high.webp,New Capital City,"Retail, DeJoya 4 Strip Mall",https://prod-images.cooingestate.com/processed/developer/logo_image/138/medium.webp,Retail for sale in DeJoya 4 Strip Mall - with in New Capital City by Taj Misr Developments.,Retail for sale in DeJoya 4 Strip Mall - with in New Capital City by Taj Misr Developments.,42,"95,594 EGP quarterly / 12 Years","4,830,000 EGP",,
https://www.nawy.com/compound/880-west-gate-business-hub/property/71799-Retail-for-sale-in-West%20gate%20Business%20Hub-with-10-bedrooms-in-El%20Sheikh%20Zayed-by-Gates%20Development,,https://prod-images.cooingestate.com/processed/inventory/brochure_images/Gates%20Developments/westgatebusinesshub/west%20Gate%207/high.webp,El Sheikh Zayed,"Retail, West gate Business Hub",https://prod-images.cooingestate.com/processed/developer/logo_image/135/medium.webp,Retail for sale in West gate Business Hub - with in El Sheikh Zayed by Gates Development.,Retail for sale in West gate Business Hub - with in El Sheikh Zayed by Gates Development.,276,"2,014,695 EGP quarterly / 4 Years","46,050,162 EGP",,
https://www.nawy.com/compound/702-maspero-mall/property/112617-retail-for-sale-in-maspero-mall-by-city-edge-developments,,https://prod-images.cooingestate.com/processed/inventory/brochure_images/City%20Edge%20Developments/masperomall/Screenshot%202026-01-15%20162511/high.webp,Downtown Cairo,"Retail, Maspero Mall",https://prod-images.cooingestate.com/processed/developer/logo_image/74/medium.webp,Retail for sale in Maspero Mall - with in Downtown Cairo by City Edge Developments.,Retail for sale in Maspero Mall - with in Downtown Cairo by City Edge Developments.,108,"893,478 EGP quarterly / 5 Years","21,023,000 EGP",,
https://www.nawy.com/compound/1607-the-gryd/property/85292-Retail-for-sale-in-The%20Gryd-with-10-bedrooms-in-New%20Cairo-by-Upwyde%20Developments,,https://prod-images.cooingestate.com/processed/inventory/brochure_images/Upwyde%20Developments/thegryd/gryd/high.webp,New Cairo,"Retail, The Gryd",https://prod-images.cooingestate.com/processed/developer/logo_image/144/medium.webp,Retail for sale in The Gryd - with in New Cairo by Upwyde Developments.,Retail for sale in The Gryd - with in New Cairo by Upwyde Developments.,770,"Starting From 3,782,048 EGP quarterly / 10 Years","168,091,000 EGP",,
https://www.nawy.com/compound/1326-west-el-balad/property/104579-Retail-for-sale-in-West%20El%20Balad-with-10-bedrooms-in-6th%20of%20October%20City-by-Centrada%20Developments,,https://prod-images.cooingestate.com/processed/inventory/brochure_images/Omar%20Abdalla%20Developments%20OAD/westelbalad/WhatsApp_Image_2025-03-11_at_3.25.50_PM%201/high.webp,6th of October City,"Retail, West El Balad",https://prod-images.cooingestate.com/processed/developer/logo_image/401/medium.webp,Retail for sale in West El Balad - with in 6th of October City by Centrada Developments.,Retail for sale in West El Balad - with in 6th of October City by Centrada Developments.,108,"150,026 EGP monthly / 8.3 Years","15,093,540 EGP",,
https://www.nawy.com/compound/1211-3-sides-mall/property/109397-Retail-for-sale-in-3%20Sides%20Mall-with-10-bedrooms-in-El%20Shorouk-by-N%20Developments,,https://prod-images.cooingestate.com/processed/inventory/brochure_images/Nawassy%20Developments/3sidesmall/3_sides_mall__1_/high.webp,El Shorouk,"Retail, 3 Sides Mall",https://prod-images.cooingestate.com/processed/developer/logo_image/381/medium.webp,Retail for sale in 3 Sides Mall - with in El Shorouk by N Developments.,Retail for sale in 3 Sides Mall - with in El Shorouk by N Developments.,81,"768,800 EGP quarterly / 5 Years","19,220,000 EGP",,
https://www.nawy.com/compound/497-paris-mall/property/94598-retail-for-sale-in-paris-mall,Resale,https://prod-images.cooingestate.com/processed/property_image/image/478177/high.webp,New Capital City,"Retail, Paris Mall",https://prod-images.cooingestate.com/processed/developer/logo_image/113/medium.webp,Retail for sale in Paris Mall - with in New Capital City by Pyramids Developments.,Retail for sale in Paris Mall - with in New Capital City by Pyramids Developments.,46,"23,600 EGP monthly / 3 Years","10,023,270 EGP",,
https://www.nawy.com/compound/1119-moray/property/54803-retail-ground-for-sale-in-moray-in-new-cairo-by-main-marks,,https://prod-images.cooingestate.com/processed/property_image/image/269236/high.webp,New Cairo,"Retail, Moray",https://prod-images.cooingestate.com/processed/developer/logo_image/358/medium.webp,Retail for sale in Moray - with in New Cairo by Main Marks.,Retail for sale in Moray - with in New Cairo by Main Marks.,228,"2,908,543 EGP quarterly / 7 Years","90,488,013 EGP",,
https://www.nawy.com/compound/1924-Nine08/property/111082-Retail-for-sale-in-Nine08-with-10-bedrooms-in-Northern%20Expansion-by-Centrada%20Developments,,https://prod-images.cooingestate.com/processed/inventory/brochure_images/Omar%20Abdalla%20Developments%20OAD/nine08/Screenshot%202025-12-24%20164933/high.webp,Northern Expansion,"Retail, Nine08",https://prod-images.cooingestate.com/processed/developer/logo_image/401/medium.webp,Retail for sale in Nine08 - with in Northern Expansion by Centrada Developments.,Retail for sale in Nine08 - with in Northern Expansion by Centrada Developments.,98,"192,019 EGP monthly / 8 Years","18,620,000 EGP",,
https://www.nawy.com/compound/1013-mamsha-almaqsad/property/99151-retail-for-sale-in-mamsha-almaqsad,Resale,https://prod-images.cooingestate.com/processed/property_image/image/536239/high.webp,New Capital City,"Retail, Mamsha Almaqsad",https://prod-images.cooingestate.com/processed/developer/logo_image/74/medium.webp,Retail for sale in Mamsha Almaqsad - with in New Capital City by City Edge Developments.,Retail for sale in Mamsha Almaqsad - with in New Capital City by City Edge Developments.,70,"43,078 EGP monthly / 7 Years","9,730,129 EGP",,
https://www.nawy.com/compound/491-the-loft-plaza/property/4630-the-loft-plaza-commercial,,https://prod-images.cooingestate.com/processed/property_image/image/19030/high.webp,New Capital City,"Retail, The Loft Plaza",https://prod-images.cooingestate.com/processed/developer/logo_image/76/medium.webp,Retail for sale in The Loft Plaza - with in New Capital City by Living Yards Developments.,Retail for sale in The Loft Plaza - with in New Capital City by Living Yards Developments.,39,"562,500 EGP quarterly / 6 Years","15,000,000 EGP",,
https://www.nawy.com/compound/1327-centrada-one/property/104614-Retail-for-sale-in-Centrada%20One-with-10-bedrooms-in-October%20Gardens-by-Centrada%20Developments,,https://prod-images.cooingestate.com/processed/inventory/brochure_images/Omar%20Abdalla%20Developments%20OAD/centradaone/Centrada_One5%201/high.webp,October Gardens,"Retail, Centrada One",https://prod-images.cooingestate.com/processed/developer/logo_image/401/medium.webp,Retail for sale in Centrada One - with in October Gardens by Centrada Developments.,Retail for sale in Centrada One - with in October Gardens by Centrada Developments.,119,"189,253 EGP monthly / 8.3 Years","19,040,000 EGP",,
https://www.nawy.com/compound/643-udora-mall/property/102312-retail-for-sale-in-udora-mall,Resale,https://prod-images.cooingestate.com/processed/property_image/image/555554/high.webp,New Capital City,"Retail, Udora Mall",https://prod-images.cooingestate.com/processed/developer/logo_image/137/medium.webp,Retail for sale in Udora Mall - with in New Capital City by Home Town Developments.,Retail for sale in Udora Mall - with in New Capital City by Home Town Developments.,40,"19,230 EGP monthly / 5 Years","2,713,533 EGP",,
https://www.nawy.com/compound/456-6ixty-iconic-tower/property/29117-6xity-iconic-tower-commercial,,https://prod-images.cooingestate.com/processed/property_image/image/119919/high.webp,New Capital City,"Retail, 6ixty Iconic Tower",https://prod-images.cooingestate.com/processed/developer/logo_image/125/medium.webp,Retail for sale in 6ixty Iconic Tower - with in New Capital City by Al - Borouj Misr Developments Group (ABM).,Retail for sale in 6ixty Iconic Tower - with in New Capital City by Al - Borouj Misr Developments Group (ABM).,64,"722,781 EGP quarterly / 5 Years","17,006,600 EGP",,
https://www.nawy.com/compound/940-track-10/property/68459-retail-for-sale-in-track-10,Resale,https://prod-images.cooingestate.com/processed/property_image/image/349705/high.webp,New Capital City,"Retail, Track 10",https://prod-images.cooingestate.com/processed/developer/logo_image/313/medium.webp,Retail for sale in Track 10 - with 1 bedroom in New Capital City by Deal Investment Group.,Retail for sale in Track 10 - with 1 bedroom in New Capital City by Deal Investment Group.,52,,"6,888,000 EGP",1,
https://www.nawy.com/compound/908-the-rift-business-park/property/72601-retail-for-sale-in-the-rift-business-park,Resale,https://prod-images.cooingestate.com/processed/property_image/image/365624/high.webp,Mostakbal City,"Retail, The Rift Business Park",https://prod-images.cooingestate.com/processed/developer/logo_image/306/medium.webp,Retail for sale in The Rift Business Park - with in Mostakbal City by LUD -Lozan Urban Development.,Retail for sale in The Rift Business Park - with in Mostakbal City by LUD -Lozan Urban Development.,35,"133,370 EGP monthly / 5 Years","10,936,776 EGP",,
https://www.nawy.com/compound/644-zaha-park-new-capital/property/52571-retail-for-sale-in-zaha-park-new-capital-in-new-capital-city-by-home-town-developments,,https://prod-images.cooingestate.com/processed/property_image/image/256903/high.webp,New Capital City,"Retail, Zaha Park - New Capital",https://prod-images.cooingestate.com/processed/developer/logo_image/137/medium.webp,Retail for sale in Zaha Park - New Capital  - with in New Capital City by Home Town Developments.,Retail for sale in Zaha Park - New Capital  - with in New Capital City by Home Town Developments.,58,"354,766 EGP quarterly / 8 Years","11,950,000 EGP",,
https://www.nawy.com/compound/425-fifth-squarethe-mall/property/95032-retail-for-sale-in-fifth-squarethe-mall,Resale,https://prod-images.cooingestate.com/processed/property_image/image/480847/high.webp,New Cairo,"Retail, Fifth SquareThe Mall",https://prod-images.cooingestate.com/processed/developer/logo_image/62/medium.webp,Retail for sale in Fifth SquareThe Mall - with in New Cairo by Al Marasem Development.,Retail for sale in Fifth SquareThe Mall - with in New Cairo by Al Marasem Development.,39,"39,870 EGP monthly / 3 Years","11,865,400 EGP",,
