url_path,tag,cover_image,location,property_name,developer_logo,title,description,m2,payment_plan,price,Beds,Baths
https://www.nawy.com/compound/1607-the-gryd/property/117610-Retail-for-sale-in-The%20Gryd-with-10-bedrooms-in-New%20Cairo-by-Upwyde%20Developments,,https://prod-images.cooingestate.com/processed/inventory/brochure_images/Upwyde%20Developments/thegryd/gryd%205/high.webp,New Cairo,"Retail, The Gryd",https://prod-images.cooingestate.com/processed/developer/logo_image/144/medium.webp,Retail for sale in The Gryd - with in New Cairo by Upwyde Developments.,Retail for sale in The Gryd - with in New Cairo by Upwyde Developments.,86,"Starting From 497,585 EGP quarterly / 10 Years","22,114,900 EGP",,
https://www.nawy.com/compound/1607-the-gryd/property/117609-Retail-for-sale-in-The%20Gryd-with-10-bedrooms-in-New%20Cairo-by-Upwyde%20Developments,,https://prod-images.cooingestate.com/processed/inventory/brochure_images/Upwyde%20Developments/thegryd/gryd%205/high.webp,New Cairo,"Retail, The Gryd",https://prod-images.cooingestate.com/processed/developer/logo_image/144/medium.webp,Retail for sale in The Gryd - with in New Cairo by Upwyde Developments.,Retail for sale in The Gryd - with in New Cairo by Upwyde Developments.,74,"Starting From 411,838 EGP quarterly / 10 Years","18,303,900 EGP",,
https://www.nawy.com/compound/1034-dejoya-plaza-residence/property/41228-en,,https://prod-images.cooingestate.com/processed/property_image/image/191270/high.webp,New Zayed,"Retail, Dejoya Plaza Residence",https://prod-images.cooingestate.com/processed/developer/logo_image/138/medium.webp,Retail for sale in Dejoya Plaza Residence - with in New Zayed by Taj Misr Developments.,Retail for sale in Dejoya Plaza Residence - with in New Zayed by Taj Misr Developments.,43,"173,715 EGP quarterly / 15 Years","10,971,450 EGP",,
https://www.nawy.com/compound/1518-maliv-street/property/81636-Retail-for-sale-in-Maliv%20Street-with-10-bedrooms-in-6th%20settlement-by-Kulture%20Developments,,https://prod-images.cooingestate.com/processed/inventory/brochure_images/Kulture%20Developments/malivstreet/Maliv%20st%202/high.webp,6th settlement,"Retail, Maliv Street",https://prod-images.cooingestate.com/processed/developer/logo_image/427/medium.webp,Retail for sale in Maliv Street - with in 6th settlement by Kulture Developments.,Retail for sale in Maliv Street - with in 6th settlement by Kulture Developments.,133,"545,944 EGP quarterly / 8 Years","19,411,350 EGP",,
https://www.nawy.com/compound/794-de-joya-1-strip-mall/property/40128-en,,https://prod-images.cooingestate.com/processed/property_image/image/182132/high.webp,New Capital City,"Retail, De joya 1 strip mall",https://prod-images.cooingestate.com/processed/developer/logo_image/138/medium.webp,Retail for sale in De joya 1 strip mall - with in New Capital City by Taj Misr Developments.,Retail for sale in De joya 1 strip mall - with in New Capital City by Taj Misr Developments.,61,"217,238 EGP quarterly / 10 Years","9,655,000 EGP",,
https://www.nawy.com/compound/605-east-tower/property/84898-retail-for-sale-in-east-tower,Resale,https://prod-images.cooingestate.com/processed/property_image/image/425556/high.webp,New Capital City,"Retail, East Tower",https://prod-images.cooingestate.com/processed/developer/logo_image/130/medium.webp,Retail for sale in East Tower - with in New Capital City by UC Developments.,Retail for sale in East Tower - with in New Capital City by UC Developments.,32,"5,630 EGP monthly / 10 Years","4,840,000 EGP",,
https://www.nawy.com/compound/1785-kay-business-park/property/103041-retail-ground-for-sale-in-k-business-park-in-6th-of-october-city-by-kayan-real-estate,,https://prod-images.cooingestate.com/processed/property_image/image/560908/high.webp,6th of October City,"Retail, K Business Park",https://prod-images.cooingestate.com/processed/developer/logo_image/432/medium.webp,Retail for sale in K Business Park - with in 6th of October City by Kayan Real Estate.,Retail for sale in K Business Park - with in 6th of October City by Kayan Real Estate.,31,"24,172 EGP monthly / 10 Years","4,462,500 EGP",,
https://www.nawy.com/compound/748-taj-tower/property/40027-en,,https://prod-images.cooingestate.com/processed/property_image/image/180960/high.webp,New Capital City,"Retail, Taj Tower",https://prod-images.cooingestate.com/processed/developer/logo_image/138/medium.webp,Retail for sale in Taj Tower - with in New Capital City by Taj Misr Developments.,Retail for sale in Taj Tower - with in New Capital City by Taj Misr Developments.,19,"150,480 EGP quarterly / 10 Years","6,688,000 EGP",,
https://www.nawy.com/compound/514-ezdan/property/40023-retail-for-sale-in-ezdan-in-new-capital-city-by-taj-misr-developments,,https://prod-images.cooingestate.com/processed/property_image/image/181177/high.webp,New Capital City,"Retail, Ezdan",https://prod-images.cooingestate.com/processed/developer/logo_image/138/medium.webp,Retail for sale in Ezdan - with in New Capital City by Taj Misr Developments.,Retail for sale in Ezdan - with in New Capital City by Taj Misr Developments.,93,"457,429 EGP quarterly / 7 Years","16,010,000 EGP",,
https://www.nawy.com/compound/465-midtown-solo-mall/property/81912-Retail-for-sale-in-Midtown%20Solo%20Mall-with-10-bedrooms-in-New%20Capital%20City-by-Better%20Home,,https://www.nawy.com/assets/images/common/broken.webp,New Capital City,"Retail, Midtown Solo Mall",https://prod-images.cooingestate.com/processed/developer/logo_image/122/medium.webp,Retail for sale in Midtown Solo Mall - with in New Capital City by Better Home.,Retail for sale in Midtown Solo Mall - with in New Capital City by Better Home.,265,"2,312,682 EGP quarterly / 8 Years","82,228,703 EGP",,
https://www.nawy.com/compound/840-striple-walk/property/28196-retail-for-sale-in-striple-walk-in-new-capital-city-by-serak-developments,,https://prod-images.cooingestate.com/processed/property_image/image/536528/high.webp,New Capital City,"Retail, Striple Walk",https://prod-images.cooingestate.com/processed/developer/logo_image/218/medium.webp,Retail for sale in Striple Walk - with in New Capital City by Town Writers.,Retail for sale in Striple Walk - with in New Capital City by Town Writers.,34,"156,085 EGP quarterly / 10 Years","7,345,175 EGP",,
https://www.nawy.com/compound/847-walk-of-cairo/property/28665-retail-for-sale-in-walk-of-cairo-in-sheikh-zayed-by-bonyan-for-developments-and-trading,,https://prod-images.cooingestate.com/processed/property_image/image/144020/high.webp,El Sheikh Zayed,"Retail, Walk Of Cairo",https://prod-images.cooingestate.com/processed/developer/logo_image/259/medium.webp,Retail for sale in Walk Of Cairo - with in El Sheikh Zayed by Bonyan for Development and Trade.,Retail for sale in Walk Of Cairo - with in El Sheikh Zayed by Bonyan for Development and Trade.,100,"1,330,000 EGP quarterly / 5 Years","28,000,000 EGP",,
https://www.nawy.com/compound/466-midtown-condo-mall/property/81884-Retail-for-sale-in-Midtown%20Condo%20Mall-with-10-bedrooms-in-New%20Capital%20City-by-Better%20Home,,https://prod-images.cooingestate.com/processed/inventory/brochure_images/Better%20Home/midtowncondomall/default4/high.webp,New Capital City,"Retail, Midtown Condo Mall",https://prod-images.cooingestate.com/processed/developer/logo_image/122/medium.webp,Retail for sale in Midtown Condo Mall - with in New Capital City by Better Home.,Retail for sale in Midtown Condo Mall - with in New Capital City by Better Home.,110,"251,763 EGP quarterly / 8 Years","8,951,587 EGP",,
https://www.nawy.com/compound/880-west-gate-business-hub/property/71798-Retail-for-sale-in-West%20gate%20Business%20Hub-with-10-bedrooms-in-El%20Sheikh%20Zayed-by-Gates%20Development,,https://prod-images.cooingestate.com/processed/inventory/brochure_images/Gates%20Developments/westgatebusinesshub/west%20Gate%206/high.webp,El Sheikh Zayed,"Retail, West gate Business Hub",https://prod-images.cooingestate.com/processed/developer/logo_image/135/medium.webp,Retail for sale in West gate Business Hub - with in El Sheikh Zayed by Gates Development.,Retail for sale in West gate Business Hub - with in El Sheikh Zayed by Gates Development.,200,"1,104,636 EGP quarterly / 4 Years","25,248,825 EGP",,
https://www.nawy.com/compound/1840-dejoya-4-strip-mall/property/101664-retail-for-sale-in-dejoya-4-strip-mall-in-new-capital-city-by-taj-misr-developments,,https://prod-images.cooingestate.com/processed/property_image/image/551378/high.webp,New Capital City,"Retail, DeJoya 4 Strip Mall",https://prod-images.cooingestate.com/processed/developer/logo_image/138/medium.webp,Retail for sale in DeJoya 4 Strip Mall - with in New Capital City by Taj Misr Developments.,Retail for sale in DeJoya 4 Strip Mall - with in New Capital City by Taj Misr Developments.,31,"118,631 EGP quarterly / 12 Years","5,994,000 EGP",,
https://www.nawy.com/compound/825-terrace/property/80771-Retail-for-sale-in-Terrace-with-10-bedrooms-in-El%20Sheikh%20Zayed-by-Housing%20and%20Development%20Properties%20HDP,,https://prod-images.cooingestate.com/processed/inventory/brochure_images/Housing%20and%20Development%20Properties/terrace/Screenshot_4%201/high.webp,El Sheikh Zayed,"Retail, Terrace",https://prod-images.cooingestate.com/processed/developer/logo_image/250/medium.webp,Retail for sale in Terrace - with in El Sheikh Zayed by Housing and Development Properties HDP.,Retail for sale in Terrace - with in El Sheikh Zayed by Housing and Development Properties HDP.,280,"2,665,210 EGP quarterly / 10 Years","109,341,960 EGP",,
https://www.nawy.com/compound/702-maspero-mall/property/112615-retail-for-sale-in-maspero-mall-by-city-edge-developments,,https://prod-images.cooingestate.com/processed/inventory/brochure_images/City%20Edge%20Developments/masperomall/Screenshot%202026-01-15%20162511/high.webp,Downtown Cairo,"Retail, Maspero Mall",https://prod-images.cooingestate.com/processed/developer/logo_image/74/medium.webp,Retail for sale in Maspero Mall - with in Downtown Cairo by City Edge Developments.,Retail for sale in Maspero Mall - with in Downtown Cairo by City Edge Developments.,108,"737,588 EGP quarterly / 7 Years","24,297,000 EGP",,
https://www.nawy.com/compound/441-midtown-sky-mall/property/81885-Retail-for-sale-in-Midtown%20Sky%20Mall-with-10-bedrooms-in-New%20Capital%20City-by-Better%20Home,,https://prod-images.cooingestate.com/processed/inventory/brochure_images/Better%20Home/midtownskymall/default1/high.webp,New Capital City,"Retail, Midtown Sky Mall",https://prod-images.cooingestate.com/processed/developer/logo_image/122/medium.webp,Retail for sale in Midtown Sky Mall - with in New Capital City by Better Home.,Retail for sale in Midtown Sky Mall - with in New Capital City by Better Home.,105,"362,852 EGP quarterly / 8 Years","12,901,400 EGP",,
https://www.nawy.com/compound/1187-five-fifty-five-business-complex/property/77223-retail-for-sale-in-five-fifty-five,Resale,https://prod-images.cooingestate.com/processed/property_image/image/386186/high.webp,El Sheikh Zayed,"Retail, Five Fifty Five Business Complex",https://prod-images.cooingestate.com/processed/developer/logo_image/375/medium.webp,Retail for sale in Five Fifty Five Business Complex - with in El Sheikh Zayed by DAL Developments.,Retail for sale in Five Fifty Five Business Complex - with in El Sheikh Zayed by DAL Developments.,76,"206,330 EGP monthly / 5 Years","16,005,525 EGP",,
https://www.nawy.com/compound/920-space-mall/property/62083-retail-office-for-sale-in-space-mall,Resale,https://prod-images.cooingestate.com/processed/property_image/image/311743/high.webp,6th of October City,"Retail, Space Mall",https://prod-images.cooingestate.com/processed/developer/logo_image/135/medium.webp,Retail for sale in Space Mall - with in 6th of October City by Gates Development.,Retail for sale in Space Mall - with in 6th of October City by Gates Development.,51,"80,070 EGP monthly / 7 Years","9,523,340 EGP",,
https://www.nawy.com/compound/1094-white-walk/property/107096-retail-for-sale-in-white-walk,Resale,https://prod-images.cooingestate.com/processed/property_image/image/594258/high.webp,New Cairo,"Retail, White Walk",https://prod-images.cooingestate.com/processed/developer/logo_image/144/medium.webp,Retail for sale in White Walk - with in New Cairo by Upwyde Developments.,Retail for sale in White Walk - with in New Cairo by Upwyde Developments.,99,"391,590 EGP monthly / 5 Years","35,326,884 EGP",,
https://www.nawy.com/compound/1326-west-el-balad/property/104576-Retail-for-sale-in-West%20El%20Balad-with-10-bedrooms-in-6th%20of%20October%20City-by-Centrada%20Developments,,https://prod-images.cooingestate.com/processed/inventory/brochure_images/Omar%20Abdalla%20Developments%20OAD/westelbalad/WhatsApp_Image_2025-03-11_at_3.25.50_PM%201/high.webp,6th of October City,"Retail, West El Balad",https://prod-images.cooingestate.com/processed/developer/logo_image/401/medium.webp,Retail for sale in West El Balad - with in 6th of October City by Centrada Developments.,Retail for sale in West El Balad - with in 6th of October City by Centrada Developments.,82,"113,909 EGP monthly / 8.3 Years","11,459,910 EGP",,
https://www.nawy.com/compound/956-stella-heights/property/80855-retail-for-sale-in-stella-heights,Resale,https://prod-images.cooingestate.com/processed/property_image/image/405950/high.webp,Sidi Abdel Rahman,"Retail, Stella Heights",https://prod-images.cooingestate.com/processed/developer/logo_image/51/medium.webp,Retail for sale in Stella Heights - with in Sidi Abdel Rahman by Remco Tourism Villages Construction.,Retail for sale in Stella Heights - with in Sidi Abdel Rahman by Remco Tourism Villages Construction.,144,"108,000 EGP monthly / 5 Years","11,700,000 EGP",,
https://www.nawy.com/compound/907-axle/property/32797-axle-new-cairo-menassat-pharmacy,,https://prod-images.cooingestate.com/processed/property_image/image/136308/high.webp,New Cairo,"Retail, Axle",https://prod-images.cooingestate.com/processed/developer/logo_image/131/medium.webp,Retail for sale in Axle - with in New Cairo by Menassat Developments.,Retail for sale in Axle - with in New Cairo by Menassat Developments.,80,"675,633 EGP quarterly / 7 Years","21,019,678 EGP",,
https://www.nawy.com/compound/1211-3-sides-mall/property/109395-Retail-for-sale-in-3%20Sides%20Mall-with-10-bedrooms-in-El%20Shorouk-by-N%20Developments,,https://prod-images.cooingestate.com/processed/inventory/brochure_images/Nawassy%20Developments/3sidesmall/3_sides_mall__1_/high.webp,El Shorouk,"Retail, 3 Sides Mall",https://prod-images.cooingestate.com/processed/developer/logo_image/381/medium.webp,Retail for sale in 3 Sides Mall - with in El Shorouk by N Developments.,Retail for sale in 3 Sides Mall - with in El Shorouk by N Developments.,59,"358,248 EGP quarterly / 5 Years","8,956,200 EGP",,
https://www.nawy.com/compound/1149-rock-gold/property/83096-Retail-for-sale-in-Rock%20Gold-with-10-bedrooms-in-El%20Lotus-by-Rock%20developments,,https://prod-images.cooingestate.com/processed/inventory/brochure_images//rockgold/Rock%20Gold%201/high.webp,El Lotus,"Retail, Rock Gold",https://prod-images.cooingestate.com/processed/developer/logo_image/447/medium.webp,Retail for sale in Rock Gold - with in El Lotus by Rock developments.,Retail for sale in Rock Gold - with in El Lotus by Rock developments.,62,,"15,529,140 EGP",,
https://www.nawy.com/compound/1119-moray/property/54802-retail-ground-for-sale-in-moray-in-new-cairo-by-main-marks,,https://prod-images.cooingestate.com/processed/property_image/image/269243/high.webp,New Cairo,"Retail, Moray",https://prod-images.cooingestate.com/processed/developer/logo_image/358/medium.webp,Retail for sale in Moray - with in New Cairo by Main Marks.,Retail for sale in Moray - with in New Cairo by Main Marks.,115,"1,332,977 EGP quarterly / 7 Years","41,470,380 EGP",,
https://www.nawy.com/compound/1000-obsidier/property/80386-retail-for-sale-in-obsidier,Resale,https://prod-images.cooingestate.com/processed/property_image/image/403581/high.webp,New Capital City,"Retail, Obsidier",https://prod-images.cooingestate.com/processed/developer/logo_image/329/medium.webp,Retail for sale in Obsidier - with in New Capital City by Dubai Misr.,Retail for sale in Obsidier - with in New Capital City by Dubai Misr.,45,"97,330 EGP monthly / 7 Years","11,500,000 EGP",,
https://www.nawy.com/compound/940-track-10/property/68453-retail-for-sale-in-track-10,Resale,https://prod-images.cooingestate.com/processed/property_image/image/349676/high.webp,New Capital City,"Retail, Track 10",https://prod-images.cooingestate.com/processed/developer/logo_image/313/medium.webp,Retail for sale in Track 10 - with 1 bedroom in New Capital City by Deal Investment Group.,Retail for sale in Track 10 - with 1 bedroom in New Capital City by Deal Investment Group.,38,,"5,803,550 EGP",1,
https://www.nawy.com/compound/643-udora-mall/property/52574-retail-for-sale-in-udora-mall-in-new-capital-city-by-home-town-developments,,https://prod-images.cooingestate.com/processed/property_image/image/256938/high.webp,New Capital City,"Retail, Udora Mall",https://prod-images.cooingestate.com/processed/developer/logo_image/137/medium.webp,Retail for sale in Udora Mall - with in New Capital City by Home Town Developments.,Retail for sale in Udora Mall - with in New Capital City by Home Town Developments.,34,"813,438 EGP quarterly / 4 Years","13,700,000 EGP",,
https://www.nawy.com/compound/1120-madar-mall/property/48544-retail-ground-for-sale-in-madar-mall-in-new-capital-city-by-tamayoz-developments,,https://prod-images.cooingestate.com/processed/property_image/image/235817/high.webp,New Capital City,"Retail, Madar Mall",https://prod-images.cooingestate.com/processed/developer/logo_image/338/medium.webp,Retail for sale in Madar Mall - with in New Capital City by Tamayoz Developments.,Retail for sale in Madar Mall - with in New Capital City by Tamayoz Developments.,37,,"5,550,000 EGP",,
https://www.nawy.com/compound/1327-centrada-one/property/104613-Retail-for-sale-in-Centrada%20One-with-10-bedrooms-in-October%20Gardens-by-Centrada%20Developments,,https://prod-images.cooingestate.com/processed/inventory/brochure_images/Omar%20Abdalla%20Developments%20OAD/centradaone/Centrada_One5%201/high.webp,October Gardens,"Retail, Centrada One",https://prod-images.cooingestate.com/processed/developer/logo_image/401/medium.webp,Retail for sale in Centrada One - with in October Gardens by Centrada Developments.,Retail for sale in Centrada One - with in October Gardens by Centrada Developments.,80,"198,795 EGP monthly / 8.3 Years","20,000,000 EGP",,
https://www.nawy.com/compound/1924-Nine08/property/111080-Retail-for-sale-in-Nine08-with-10-bedrooms-in-Northern%20Expansion-by-Centrada%20Developments,,https://prod-images.cooingestate.com/processed/inventory/brochure_images/Omar%20Abdalla%20Developments%20OAD/nine08/Screenshot%202025-12-24%20164933/high.webp,Northern Expansion,"Retail, Nine08",https://prod-images.cooingestate.com/processed/developer/logo_image/401/medium.webp,Retail for sale in Nine08 - with in Northern Expansion by Centrada Developments.,Retail for sale in Nine08 - with in Northern Expansion by Centrada Developments.,67,"138,188 EGP monthly / 8 Years","13,400,000 EGP",,
https://www.nawy.com/compound/1340-there/property/106367-retail-ground-for-sale-in-there-in-new-cairo-by-lmd,,https://prod-images.cooingestate.com/processed/property_image/image/587094/high.webp,New Cairo,"Retail, There",https://prod-images.cooingestate.com/processed/developer/logo_image/72/medium.webp,Retail for sale in There  - with in New Cairo by LMD.,Retail for sale in There  - with in New Cairo by LMD.,128,"1,078,200 EGP quarterly / 8 Years","38,336,000 EGP",,
https://www.nawy.com/compound/1644-mazarine-commercial/property/83371-retail-for-sale-in-mazarine-in-al-alamein-by-city-edge-developments,,https://prod-images.cooingestate.com/processed/property_image/image/417904/high.webp,Al Alamein,"Retail, Mazarine Commercial",https://prod-images.cooingestate.com/processed/developer/logo_image/74/medium.webp,Retail for sale in Mazarine Commercial - with in Al Alamein by City Edge Developments.,Retail for sale in Mazarine Commercial - with in Al Alamein by City Edge Developments.,183,"627,233 EGP quarterly / 10 Years","27,877,000 EGP",,
https://www.nawy.com/compound/413-rivan-square/property/109358-Retail-for-sale-in-Rivan%20Square-with-10-bedrooms-in-New%20Capital%20City-by-Altameer%20Arabian%20Developments%20CO.,,https://prod-images.cooingestate.com/processed/inventory/brochure_images/Altameer%20Arabian/rivansquare/Screenshot%202025-12-02%20174927/high.webp,New Capital City,"Retail, Rivan Square",https://prod-images.cooingestate.com/processed/developer/logo_image/96/medium.webp,Retail for sale in Rivan Square - with in New Capital City by Altameer Arabian Developments CO..,Retail for sale in Rivan Square - with in New Capital City by Altameer Arabian Developments CO..,86,,"10,881,236 EGP",,
https://www.nawy.com/compound/1033-dejoya-primero-villas/property/41110-retail-for-sale-in-dejoya-primero-villas-in-el-sheikh-zayed-by-taj-misr-developments,,https://prod-images.cooingestate.com/processed/property_image/image/191223/high.webp,New Zayed,"Retail, Dejoya Primero Villas",https://prod-images.cooingestate.com/processed/developer/logo_image/138/medium.webp,Retail for sale in Dejoya Primero Villas - with in New Zayed by Taj Misr Developments.,Retail for sale in Dejoya Primero Villas - with in New Zayed by Taj Misr Developments.,75,"336,656 EGP quarterly / 15 Years","21,262,500 EGP",,
https://www.nawy.com/compound/908-the-rift-business-park/property/61674-retail-for-sale-in-the-rift-business-park,Resale,https://prod-images.cooingestate.com/processed/property_image/image/308811/high.webp,Mostakbal City,"Retail, The Rift Business Park",https://prod-images.cooingestate.com/processed/developer/logo_image/306/medium.webp,Retail for sale in The Rift Business Park - with in Mostakbal City by LUD -Lozan Urban Development.,Retail for sale in The Rift Business Park - with in Mostakbal City by LUD -Lozan Urban Development.,34,"50,000 EGP monthly / 6 Years","9,127,860 EGP",,
https://www.nawy.com/compound/481-la-fayette-village/property/52579-retail-for-sale-in-la-fayette-village-in-new-capital-city-by-home-town-developments,,https://prod-images.cooingestate.com/processed/property_image/image/256847/high.webp,New Capital City,"Retail, La Fayette Village",https://prod-images.cooingestate.com/processed/developer/logo_image/137/medium.webp,Retail for sale in La Fayette Village - with in New Capital City by Home Town Developments.,Retail for sale in La Fayette Village - with in New Capital City by Home Town Developments.,64,"1,195,931 EGP quarterly / 4 Years","20,142,000 EGP",,
https://www.nawy.com/compound/425-fifth-squarethe-mall/property/77389-retail-for-sale-in-fifth-squarethe-mall,Resale,https://prod-images.cooingestate.com/processed/property_image/image/387090/high.webp,New Cairo,"Retail, Fifth SquareThe Mall",https://prod-images.cooingestate.com/processed/developer/logo_image/62/medium.webp,Retail for sale in Fifth SquareThe Mall - with in New Cairo by Al Marasem Development.,Retail for sale in Fifth SquareThe Mall - with in New Cairo by Al Marasem Development.,183,"123,481 EGP monthly / 4 Years","39,606,814 EGP",,
https://www.nawy.com/compound/838-city-hall/property/28240-retail-for-sale-in-city-hall-in-new-cairo-by-serak-developments,,https://prod-images.cooingestate.com/processed/property_image/image/173708/high.webp,North Investors,"Retail, City Hall",https://prod-images.cooingestate.com/processed/developer/logo_image/254/medium.webp,Retail for sale in City Hall - with in North Investors by SERAC Developments.,Retail for sale in City Hall - with in North Investors by SERAC Developments.,131,"2,489,000 EGP quarterly / 5 Years","55,311,111 EGP",,
https://www.nawy.com/compound/1254-valory-mall/property/58497-retail-for-sale-in-valory-mall-in-new-cairo-by-menassat-developments,,https://prod-images.cooingestate.com/processed/property_image/image/327909/high.webp,New Cairo,"Retail, Valory Mall",https://prod-images.cooingestate.com/processed/developer/logo_image/131/medium.webp,Retail for sale in Valory Mall - with in New Cairo by Menassat Developments.,Retail for sale in Valory Mall - with in New Cairo by Menassat Developments.,44,"411,642 EGP quarterly / 7 Years","12,806,640 EGP",,
https://www.nawy.com/compound/1083-city-hall-strip/property/44185-retail-ground-for-sale-in-city-hall-strip-in-new-capital-city-by-serac-developments,,https://prod-images.cooingestate.com/processed/property_image/image/216157/high.webp,New Capital City,"Retail, City Hall Strip",https://prod-images.cooingestate.com/processed/developer/logo_image/254/medium.webp,Retail for sale in City Hall Strip - with in New Capital City by SERAC Developments.,Retail for sale in City Hall Strip - with in New Capital City by SERAC Developments.,54,"315,000 EGP quarterly / 6 Years","8,400,000 EGP",,
https://www.nawy.com/compound/879-gates-prive/property/47678-Retail-for-sale-in-Gates%20Prive-with-10-bedrooms-in-Northern%20Expansion-by-Gates%20Development,,https://prod-images.cooingestate.com/processed/inventory/brochure_images/Gates%20Developments/gatesprive/gates%20prive%204/high.webp,Northern Expansion,"Retail, Gates Prive",https://prod-images.cooingestate.com/processed/developer/logo_image/135/medium.webp,Retail for sale in Gates Prive - with in Northern Expansion by Gates Development.,Retail for sale in Gates Prive - with in Northern Expansion by Gates Development.,150,"731,600 EGP quarterly / 6 Years","19,509,336 EGP",,
